{
  "schemaVersion": 1,
  "mode": "tower",
  "startingGold": 100,
  "placeCost": 40,
  "slots": [
    {
      "id": "pad-a",
      "x": 480,
      "y": 200,
      "radius": 36
    },
    {
      "id": "pad-b",
      "x": 640,
      "y": 270,
      "radius": 36
    }
  ],
  "upgrades": [
    {
      "cost": 0,
      "range": 400,
      "damage": 10
    },
    {
      "cost": 30,
      "range": 480,
      "damage": 20
    }
  ],
  "actors": [
    {
      "id": "creep-a",
      "x": 280,
      "y": 180,
      "range": 40,
      "damage": 1,
      "cooldownMs": 600,
      "team": "enemy",
      "health": 2
    },
    {
      "id": "creep-b",
      "x": 280,
      "y": 360,
      "range": 40,
      "damage": 1,
      "cooldownMs": 600,
      "team": "enemy",
      "health": 2
    }
  ]
}
